{
  "_links" : {
    "self" : {
      "href" : "/self-assessment/2234567890/2016-17/liability"
    }
  },
  "income" : {
    "incomes" : {
      "nonSavings" : {
        "employment" : [ {
          "sourceId" : "employment-1",
          "pay" : 1000,
          "benefitsAndExpenses" : 500,
          "allowableExpenses" : 250,
          "total" : 1250
        }, {
          "sourceId" : "employment-2",
          "pay" : 2000,
          "benefitsAndExpenses" : 1000,
          "allowableExpenses" : 500,
          "total" : 2500
        } ],
        "selfEmployment" : [ {
          "sourceId" : "self-employment-1",
          "taxableProfit" : 8200,
          "profit" : 10000
        }, {
          "sourceId" : "self-employment-2",
          "taxableProfit" : 25000,
          "profit" : 28000
        } ],
        "ukProperties" : [ {
          "sourceId" : "property1",
          "profit" : 2000
        }, {
          "sourceId" : "property2",
          "profit" : 1500
        } ],
        "furnishedHolidayLettings" : [ {
          "sourceId" : "furnished-holiday-letting-1",
          "profit" : 8200
        }, {
          "sourceId" : "furnished-holiday-letting-2",
          "profit" : 25000
        } ]
      },
      "savings" : {
        "fromUKBanksAndBuildingSocieties" : [ {
          "sourceId" : "interest-income-1",
          "totalInterest" : 100
        }, {
          "sourceId" : "interest-income-2",
          "totalInterest" : 200
        } ]
      },
      "dividends" : {
        "fromUKSources" : [ {
          "sourceId" : "dividend-income-1",
          "totalDividend" : 1000
        }, {
          "sourceId" : "dividend-income-2",
          "totalDividend" : 2000
        } ]
      },
      "total" : 93039
    },
    "deductions" : {
      "incomeTaxRelief" : 5000,
      "personalAllowance" : 9440,
      "retirementAnnuityContract" : 10000,
      "total" : 24440
    },
    "totalIncomeOnWhichTaxIsDue" : 80000
  },
  "incomeTaxCalculations" : {
    "nonSavings" : [ {
      "taxBand" : "basicRate",
      "taxableAmount" : 10000,
      "chargedAt" : "20%",
      "tax" : 2000
    }, {
      "taxBand" : "higherRate",
      "taxableAmount" : 10000,
      "chargedAt" : "40%",
      "tax" : 4000
    }, {
      "taxBand" : "additionalHigherRate",
      "taxableAmount" : 10000,
      "chargedAt" : "45%",
      "tax" : 4500
    } ],
    "savings" : [ {
      "taxBand" : "startingRate",
      "taxableAmount" : 10000,
      "chargedAt" : "0%",
      "tax" : 0
    }, {
      "taxBand" : "nilRate",
      "taxableAmount" : 10000,
      "chargedAt" : "0%",
      "tax" : 0
    }, {
      "taxBand" : "basicRate",
      "taxableAmount" : 10000,
      "chargedAt" : "20%",
      "tax" : 2000
    }, {
      "taxBand" : "higherRate",
      "taxableAmount" : 10000,
      "chargedAt" : "40%",
      "tax" : 4000
    }, {
      "taxBand" : "additionalHigherRate",
      "taxableAmount" : 10000,
      "chargedAt" : "45%",
      "tax" : 4500
    } ],
    "dividends" : [ {
      "taxBand" : "nilRate",
      "taxableAmount" : 10000,
      "chargedAt" : "0%",
      "tax" : 0
    }, {
      "taxBand" : "basicRate",
      "taxableAmount" : 10000,
      "chargedAt" : "20%",
      "tax" : 2000
    }, {
      "taxBand" : "higherRate",
      "taxableAmount" : 10000,
      "chargedAt" : "40%",
      "tax" : 4000
    }, {
      "taxBand" : "additionalHigherRate",
      "taxableAmount" : 10000,
      "chargedAt" : "45%",
      "tax" : 4500
    } ],
    "total" : 31500
  },
  "otherCharges" : {
    "pensionSavings" : [ {
      "taxBand" : "basicRate",
      "taxableAmount" : 10000,
      "chargedAt" : "20%",
      "tax" : 2000
    }, {
      "taxBand" : "higherRate",
      "taxableAmount" : 10000,
      "chargedAt" : "40%",
      "tax" : 4000
    }, {
      "taxBand" : "additionalHigherRate",
      "taxableAmount" : 10000,
      "chargedAt" : "45%",
      "tax" : 4500
    } ],
    "total" : 10500
  },
  "taxDeducted" : {
    "interestFromUk" : 0,
    "taxPaidByPensionScheme" : 10500,
    "fromUkProperties" : [ ],
    "fromEmployments" : [ {
      "sourceId" : "employment-1",
      "taxPaid" : 4000
    }, {
      "sourceId" : "employment-2",
      "taxPaid" : 5000
    } ],
    "total" : 0
  },
  "totalTaxDue" : 25796.95,
  "totalTaxOverpaid" : 0
}